{
  "graded_sha256": "b79ed176ea5e0b4df178c939ee36f2d56e1678b50d7eb0d5905cf586ccb76fbb",
  "lane": "templates",
  "pass_nonce": "b457e3ee09da878b58a35cc7f9bb2f89",
  "schema_version": 1,
  "verdicts": [
    {
      "id": "2026-09-09-check-docs-02/templates#1",
      "verdict": "HONORED",
      "question": "none",
      "evidence": "templates/README.md:23-24 now read `{{tool.version}}, {{files}}` (commit-message.tmpl) and `{{from}}, {{to}}, {{files}}, {{abandoned}}` (bump-message.tmpl) — `{{package.name}}` dropped from both cells. Verified against current templates/commit-message.tmpl and templates/bump-message.tmpl: the Slots cells now exactly match the templates' actual placeholders.",
      "class_surfaces": [
        {
          "surface": "templates/README.md:23",
          "swept": true,
          "evidence": "commit-message.tmpl row's Slots cell corrected to `{{tool.version}}, {{files}}`, matching the template's actual two placeholders."
        },
        {
          "surface": "templates/README.md:24",
          "swept": true,
          "evidence": "bump-message.tmpl row's Slots cell corrected to `{{from}}, {{to}}, {{files}}, {{abandoned}}`, matching the template's actual four placeholders."
        }
      ]
    },
    {
      "id": "2026-09-09-check-docs-02/templates#2",
      "verdict": "HONORED",
      "question": "none",
      "evidence": "templates/regressions-README.md:1 changed to `<!-- gbg:managed regressions-README.md v{{tool.version}} — rewritten by `gbg sync`; do not edit -->`, matching SKILL.md.tmpl's `v{{tool.version}}` form per the hint. Confirmed `tool.version` is a live slot at Sync.jl:221's render call (s = slots(cfg) always carries tool.version, Sync.jl:116); README.md:22's Slots cell was updated in lockstep to `{{tool.version}}`.",
      "class_surfaces": [
        {
          "surface": "templates/regressions-README.md:1",
          "swept": true,
          "evidence": "the flagged file — version stamp added, matches sibling form."
        },
        {
          "surface": "templates/SKILL.md.tmpl:6",
          "swept": true,
          "evidence": "already carried v{{tool.version}}; untouched, still compliant."
        },
        {
          "surface": "templates/claude-md.block:1",
          "swept": true,
          "evidence": "already carried v{{tool.version}} sha256:{{sha256}}; untouched, still compliant."
        },
        {
          "surface": "templates/gitignore.block:1",
          "swept": true,
          "evidence": "already carried v{{tool.version}}; untouched, still compliant."
        }
      ]
    },
    {
      "id": "2026-09-09-check-docs-02/templates#3",
      "verdict": "HONORED",
      "question": "none",
      "evidence": "templates/README.md:26-29's 'Managed headers' paragraph gained an explicit queue-guard.sh.tmpl exception (the hint's first offered remedy). Verified accurate: Sync.jl:219 renders queue-guard.sh.tmpl raw (no header call, as the finding states), yet Sync.jl:632 still records {template, version, sha256} for it and classify() (Sync.jl:523-533) detects MODIFIED/STALE purely off that sidecar sha256 regardless of an in-file header — 'the sidecar hash is what marks it managed' is factually correct.",
      "class_surfaces": [
        {
          "surface": "templates/README.md:26-29",
          "swept": true,
          "evidence": "the blanket claim is now qualified with the queue-guard.sh.tmpl exception, resolving the contradiction the finding names."
        },
        {
          "surface": "templates/queue-guard.sh.tmpl:1-40",
          "swept": true,
          "evidence": "still carries no header by design; its lack of a header is now documented as a stated exception rather than left contradicting the general rule."
        }
      ]
    }
  ]
}
