{
  "schema_version": 1,
  "lane": "rationale",
  "graded_sha256": "9c0bccf80add89c6a05f0c08696278701eb8f5228eab2a7b944f8810562abcd6",
  "pass_nonce": "e61933077f591bb5665d031076da42ba",
  "verdicts": [
    {
      "id": "2026-09-10-check-docs-03/rationale#2",
      "verdict": "HONORED",
      "question": "none",
      "evidence": "The pass-5 diff (07fa463..01baa4d) touches only docs/prose_shape.csv and docs/src/index.md, not this finding's surfaces — the fix landed in an earlier pass of this same round. Current corpus confirms it is correct and complete: docs/ARCHITECTURE.md:495 and docs/src/architecture.md:495 read '(`Reflection.package_operations()`) to `.gbg/scratch/public_surface.json`'; ARCHITECTURE.md:538/architecture.md:538 read '`Reflection.package_operations()`, which it CALLS and does not define'; the §3 tree's TestHarness.jl line (ARCHITECTURE.md:987) lists only 'run_regressions, display gate, thread-subprocess check, gate()' while the Reflection.jl line (988) carries 'public surface'. No stray 'TestHarness.package_operations' remains anywhere in the corpus.",
      "class_surfaces": [
        {
          "surface": "docs/ARCHITECTURE.md:495",
          "swept": true,
          "evidence": "reads 'Reflection.package_operations()' (was TestHarness.package_operations())"
        },
        {
          "surface": "docs/ARCHITECTURE.md:538",
          "swept": true,
          "evidence": "TestHarness bullet now reads 'Reflection.package_operations(), which it CALLS and does not define'"
        },
        {
          "surface": "docs/ARCHITECTURE.md:987",
          "swept": true,
          "evidence": "§3 tree's TestHarness.jl line no longer lists package_operations; Reflection.jl line (988) carries 'public surface'"
        },
        {
          "surface": "docs/src/architecture.md:495",
          "swept": true,
          "evidence": "mirror of ARCHITECTURE.md carries the same corrected text"
        },
        {
          "surface": "docs/src/architecture.md:538",
          "swept": true,
          "evidence": "mirror of ARCHITECTURE.md carries the same corrected text"
        },
        {
          "surface": "src/Reflection.jl:264",
          "swept": true,
          "evidence": "defines package_operations; already the correct owning module, exported at Reflection.jl:21"
        },
        {
          "surface": "src/TestHarness.jl:98,226,407",
          "swept": true,
          "evidence": "only ever calls Reflection.package_operations(pkg, modules); defines nothing of that name"
        }
      ]
    }
  ]
}
