{
  "schema_version": 1,
  "lane": "templates",
  "graded_sha256": "b79ed176ea5e0b4df178c939ee36f2d56e1678b50d7eb0d5905cf586ccb76fbb",
  "pass_nonce": "14120325f0599a8c9085dd694615df3f",
  "verdicts": [
    {
      "id": "2026-09-09-check-docs-02/templates#1",
      "verdict": "HONORED",
      "question": "none",
      "evidence": "templates/README.md:22-23 dropped `{{package.name}}` from the commit-message.tmpl and bump-message.tmpl Slots cells, which now read exactly `{{tool.version}}, {{files}}` and `{{from}}, {{to}}, {{files}}, {{abandoned}}` — verified against templates/commit-message.tmpl and templates/bump-message.tmpl, which contain precisely those placeholders and no `{{package.name}}`.",
      "class_surfaces": [
        {
          "surface": "templates/README.md:22 (commit-message.tmpl row)",
          "swept": true,
          "evidence": "Slots cell now `{{tool.version}}`, `{{files}}` — matches templates/commit-message.tmpl:1-9 exactly"
        },
        {
          "surface": "templates/README.md:23 (bump-message.tmpl row)",
          "swept": true,
          "evidence": "Slots cell now `{{from}}`, `{{to}}`, `{{files}}`, `{{abandoned}}` — matches templates/bump-message.tmpl:1-9 exactly"
        }
      ]
    },
    {
      "id": "2026-09-09-check-docs-02/templates#2",
      "verdict": "HONORED",
      "question": "none",
      "evidence": "templates/regressions-README.md:1 now reads `<!-- gbg:managed regressions-README.md v{{tool.version}} — rewritten by \\`gbg sync\\`; do not edit -->`, matching SKILL.md.tmpl:6's `v{{tool.version}}` form; templates/README.md's Slots row for regressions-README.md was updated in the same diff to add `{{tool.version}}` so the table stays truthful.",
      "class_surfaces": [
        {
          "surface": "templates/regressions-README.md:1",
          "swept": true,
          "evidence": "version stamp `v{{tool.version}}` added to the baked-in header"
        },
        {
          "surface": "templates/SKILL.md.tmpl:6",
          "swept": true,
          "evidence": "sibling already carried `v{{tool.version}}`, cited as the reference form, unchanged and consistent"
        },
        {
          "surface": "templates/claude-md.block:1",
          "swept": true,
          "evidence": "sibling already carries `v{{tool.version}}`, unchanged and consistent"
        },
        {
          "surface": "templates/gitignore.block:1",
          "swept": true,
          "evidence": "sibling already carries `v{{tool.version}}`, unchanged and consistent"
        }
      ]
    },
    {
      "id": "2026-09-09-check-docs-02/templates#3",
      "verdict": "HONORED",
      "question": "none",
      "evidence": "templates/README.md's Managed-headers paragraph now adds: \"One exception: `queue-guard.sh.tmpl` is copied byte-for-byte from PF's Stop hook and carries no header, so the upstream text stays comparable; the sidecar hash is what marks it managed.\" This is accurate: src/CLI/Sync.jl:219 wraps queue-guard.sh.tmpl in a ManagedFile like every other G file, so managed.json (the sidecar) does track it despite no in-body header, resolving the contradiction the finding named rather than merely asserting it away.",
      "class_surfaces": [
        {
          "surface": "templates/queue-guard.sh.tmpl:1",
          "swept": true,
          "evidence": "the only G-class file with no header at all; now carries a documented exception in templates/README.md rather than a silent contradiction"
        },
        {
          "surface": "templates/settings.json.tmpl (G, JSON)",
          "swept": true,
          "evidence": "already covered by the pre-existing 'none for JSON (the sidecar is the record)' clause, untouched by this diff and not contradicted"
        },
        {
          "surface": "templates/SKILL.md.tmpl, claude-md.block, gitignore.block, regressions-README.md (G, headered)",
          "swept": true,
          "evidence": "all carry a stamped header consistent with the general rule, unaffected"
        }
      ]
    }
  ]
}
