{
  "schema_version": 1,
  "lane": "templates",
  "graded_sha256": "b79ed176ea5e0b4df178c939ee36f2d56e1678b50d7eb0d5905cf586ccb76fbb",
  "pass_nonce": "9d99391b7f985c834c5e6cfc4e76855b",
  "verdicts": [
    {
      "id": "2026-09-09-check-docs-02/templates#1",
      "verdict": "HONORED",
      "question": "none",
      "evidence": "templates/README.md:23-24 diff drops `{{package.name}}` from the commit-message.tmpl and bump-message.tmpl Slots cells (now `{{tool.version}}`, `{{files}}` and `{{from}}`, `{{to}}`, `{{files}}`, `{{abandoned}}`); grep of both templates confirms no `{{package.name}}` in commit-message.tmpl or bump-message.tmpl, matching the corrected rows exactly.",
      "class_surfaces": [
        {
          "surface": "templates/README.md:23 (commit-message.tmpl row)",
          "swept": true,
          "evidence": "Slots cell corrected to `{{tool.version}}`, `{{files}}`; templates/commit-message.tmpl contains no `{{package.name}}`."
        },
        {
          "surface": "templates/README.md:24 (bump-message.tmpl row)",
          "swept": true,
          "evidence": "Slots cell corrected to `{{from}}`, `{{to}}`, `{{files}}`, `{{abandoned}}`; templates/bump-message.tmpl contains no `{{package.name}}`."
        }
      ]
    },
    {
      "id": "2026-09-09-check-docs-02/templates#2",
      "verdict": "HONORED",
      "question": "none",
      "evidence": "templates/regressions-README.md:1 diff changes `<!-- gbg:managed regressions-README.md — ... -->` to `<!-- gbg:managed regressions-README.md v{{tool.version}} — ... -->`, matching SKILL.md.tmpl:6's `v{{tool.version}}` form exactly, and templates/README.md:23's Slots row for regressions-README.md was updated to `{{tool.version}}` to match.",
      "class_surfaces": [
        {
          "surface": "templates/regressions-README.md:1",
          "swept": true,
          "evidence": "header line now reads `<!-- gbg:managed regressions-README.md v{{tool.version}} — rewritten by `gbg sync`; do not edit -->`."
        },
        {
          "surface": "templates/SKILL.md.tmpl:6",
          "swept": true,
          "evidence": "already carried `v{{tool.version}}` before and after the diff; the finding cited it as the correct sibling form, not as a defect site."
        },
        {
          "surface": "templates/claude-md.block:1",
          "swept": true,
          "evidence": "already carries `v{{tool.version}}`, unchanged; cited by the finding as another correctly-versioned sibling."
        },
        {
          "surface": "templates/gitignore.block:1",
          "swept": true,
          "evidence": "already carries `v{{tool.version}}`, unchanged; cited by the finding as another correctly-versioned sibling."
        }
      ]
    },
    {
      "id": "2026-09-09-check-docs-02/templates#3",
      "verdict": "HONORED",
      "question": "none",
      "evidence": "templates/README.md's Managed headers paragraph gained: 'One exception: `queue-guard.sh.tmpl` is copied byte-for-byte from PF's Stop hook and carries no header, so the upstream text stays comparable; the sidecar hash is what marks it managed.' This is exactly the first of the finding's two named remedies (qualify the paragraph with the exception); src/CLI/Sync.jl:219 confirms queue-guard.sh.tmpl is pushed via ManagedFile with the raw template body (no render/header) and tracked only through the sidecar, matching the added text.",
      "class_surfaces": [
        {
          "surface": "templates/queue-guard.sh.tmpl:1 (the only G-classed, `#`-comment-format template)",
          "swept": true,
          "evidence": "README.md now carries an explicit exception clause naming this file and its reason (byte-for-byte PF hook, sidecar-hash-tracked); grep of the templates directory finds gitignore.block (the only other `#`-comment G file) already carries its own hand-written `# gbg:managed begin v{{tool.version}} ...` header, so no other `#`-format G template silently lacks one."
        }
      ]
    }
  ]
}
