{
  "schema_version": 1,
  "lane": "src",
  "graded_sha256": "50be23464e9d7fd6938d2fd0251b7925db18a1e3663b5f3de9d41c673f54b0f6",
  "pass_nonce": "e444be6ab10844ea17db90797abe745d",
  "verdicts": [
    {
      "id": "2026-09-09-check-docs-01/src#1",
      "verdict": "HONORED",
      "question": "none",
      "evidence": "src/TreeHash.jl:47 now reads `_nonempty(path, skip) || continue` (was `isempty(_nonempty(path, skip)) && continue`), exactly inverting the guard per the hint so a directory with no files anywhere below it is skipped, matching git's own omission rule. test/treehash.jl (new) asserts G.TreeHash.tree_hash(dir) == git write-tree over a tree containing a nested empty subdirectory (sub/deeper-empty), and separately that a directory holding only an empty subdirectory hashes to git's well-known empty-tree id 4b825dc642cb6eb9a060e54bf8d69288fbee4904 — verified directly against real git, not just against the description.",
      "class_surfaces": [
        {
          "surface": "src/TreeHash.jl:47",
          "swept": true,
          "evidence": "the only `isempty(...)` call in src/ext wrapping a Bool-returning helper (`_nonempty`); grep of all `isempty(` sites in src/ shows every other call taking a collection or string, none a scalar/Bool, so the isempty-on-a-Bool class had exactly one site and it is fixed"
        }
      ]
    },
    {
      "id": "2026-09-09-check-docs-01/src#2",
      "verdict": "HONORED",
      "question": "none",
      "evidence": "src/CLI/Passes.jl:161 adds `hit_needle(text) = first(strip(last(split(text, \": \"))), 40)` and line 170's rescan_alive now calls `hit_needle(h.text)` in place of the raw `[1:min(end,40)]` byte slice — matching the hint's `first(last(split(h.text, \": \")), 40)` idiom used elsewhere in the codebase (Reflection.jl, Witnesses.jl, Scan.jl). test/rounds.jl (new @testset \"hit needle\") exercises it directly with Greek letters and math glyphs (αβγδε ≤ ∇ ⟨u⟩) at the exact 40-character boundary and asserts length 40 with no StringIndexError, plus a short-string case.",
      "class_surfaces": [
        {
          "surface": "src/CLI/Passes.jl:167 (was; now 170)",
          "swept": true,
          "evidence": "grep for `[1:min(end` across src/ext/docs finds no remaining raw byte-index truncation; this was the single site of the anti-pattern (every other truncation in the codebase already used the char-safe `first(s, n)` idiom, as the finding itself states), and it is now converted"
        }
      ]
    }
  ]
}
