{
  "schema_version": 1,
  "lane": "operational-claims",
  "graded_sha256": "b79ed176ea5e0b4df178c939ee36f2d56e1678b50d7eb0d5905cf586ccb76fbb",
  "pass_nonce": "420e6ee72163ae71e60d778ea66a30ed",
  "verdicts": [
    {
      "id": "2026-09-09-check-docs-02/operational-claims#1",
      "verdict": "HONORED",
      "question": "none",
      "evidence": "src/Scan.jl:459-467 (hard loop) and src/Scan.jl:474-480 (triage loop): both DEAD branches now print `-- yet N hit(s), so its own population counter is wrong` and loop `format_hit(h)` over r.hits instead of returning silently; docstring at src/Scan.jl:439-451 states this explicitly ('Its hits are still printed'). Matches the field_docs.jl NOLIST scenario cited as evidence: those hits now surface even at checked=0.",
      "class_surfaces": [
        {
          "surface": "src/Scan.jl:447 (hard-tier DEAD branch)",
          "swept": true,
          "evidence": "now `if dead(r) ... for h in r.hits; println(io, ...); end`"
        },
        {
          "surface": "src/Scan.jl:461 (triage-tier DEAD branch, 'the same guard repeats')",
          "swept": true,
          "evidence": "same hits-printing loop added symmetrically"
        }
      ]
    },
    {
      "id": "2026-09-09-check-docs-02/operational-claims#2",
      "verdict": "HONORED",
      "question": "none",
      "evidence": "src/TestHarness.jl:306-308: order is now `Iterators.flatten((owned, (pkg,), modules, externals))` — externals is literally last, after modules, reversing the old `((pkg,), externals, modules)`. Docstring at src/TestHarness.jl:298 keeps 'externals ... searched last' and now matches the code; new paragraph at 300-303 explains the owned-module-first rationale.",
      "class_surfaces": [
        {
          "surface": "src/TestHarness.jl:306 (resolve_function)",
          "swept": true,
          "evidence": "flatten order verified against docstring text"
        },
        {
          "surface": "src/TestHarness.jl:335 (module_method_count, consumer of resolve_function)",
          "swept": true,
          "evidence": "calls resolve_function unchanged, inherits corrected order"
        }
      ]
    },
    {
      "id": "2026-09-09-check-docs-02/operational-claims#3",
      "verdict": "HONORED",
      "question": "none",
      "evidence": "src/Reflection.jl:419-421: `examined[] += 1` moved to after the `if def === :extension ... continue end` block, so an extension-homed binding no longer increments the 'compared' counter. A falsifying test exists at test/scans.jl:74-98 (fixture 'extension-homed', asserting `r.population > 0 && all(h -> !occursin(\"EXTENSION-HOMED\", h.text), r.hits)` and a specific note text), confirming the fix is exercised, not just claimed.",
      "class_surfaces": [
        {
          "surface": "src/Reflection.jl:419 (signature_fidelity examined increment)",
          "swept": true,
          "evidence": "increment now strictly after the extension-homed `continue`"
        }
      ]
    },
    {
      "id": "2026-09-09-check-docs-02/operational-claims#4",
      "verdict": "HONORED",
      "question": "none",
      "evidence": "src/CLI/Config.jl:168 docstring now reads 'the docs/make.jl the config schema pins docs_build to name' instead of implying check_paths derives the path from docs_build; a new comment at src/CLI/Config.jl:207-210 states the schema (`schema/config.schema.json:129-132`, pattern `docs/make\\.jl`, required key) pins the command to that string, so the hardcoded existence check cannot diverge from what docs_build is constrained to name. Verified the schema pattern actually exists and requires docs_build.",
      "class_surfaces": [
        {
          "surface": "src/CLI/Config.jl:168 (check_paths docstring)",
          "swept": true,
          "evidence": "reworded to describe the schema-pin mechanism rather than a false dynamic-derivation claim"
        }
      ]
    },
    {
      "id": "2026-09-09-check-docs-02/operational-claims#6",
      "verdict": "HONORED",
      "question": "none",
      "evidence": "src/TestHarness.jl:194: 'a frozen count above its ideal must carry a named holder' changed to 'a frozen count differing from its ideal must carry a named holder', now matching Traffic's own docstring wording at src/TestHarness.jl:164 ('REQUIRED whenever frozen ≠ ideal') and the actual `!=` test at src/TestHarness.jl:202. No other 'above its ideal' phrasing survives anywhere in src/.",
      "class_surfaces": [
        {
          "surface": "src/TestHarness.jl:194 (audit() docstring)",
          "swept": true,
          "evidence": "'above' replaced by 'differing from'; grep for 'above its ideal' across src/ returns nothing"
        }
      ]
    },
    {
      "id": "2026-09-09-check-docs-02/operational-claims#7",
      "verdict": "LINE-ONLY",
      "question": "fidelity",
      "evidence": "src/Scans/sibling_link.jl:17-33 now scans past the first mention (no `break`), but only flags a later mention when it matches `home_re` (site root immediately closed by a quote/paren, line 24). A later mention linking to a specific sub-page of the sibling's site (a deep link) is silently exempted via a code comment ('a cross-reference ... not the redundant repetition the rule forbids', line 22-23) that appears nowhere in the file's own unmodified header (lines 1-4, still an unqualified 'later mentions in the unit are bare code spans') or in policy/docs-rubric.md's RULE.DOC.SIBLING_LINK (also unmodified, same unqualified wording). The reported instance (zero enforcement past the first mention) is fixed, but the class the header still literally claims ('any later mention is a bare code span') is not fully enforced — a later deep link is a live surviving gap, un-flagged and undocumented as an exception.",
      "class_surfaces": [
        {
          "surface": "src/Scans/sibling_link.jl:1-4 (file header, unchanged)",
          "swept": false,
          "evidence": "still states the absolute rule with no deep-link carve-out, while the implementation now silently exempts deep links"
        },
        {
          "surface": "policy/docs-rubric.md:187-190 (RULE.DOC.SIBLING_LINK, unchanged)",
          "swept": false,
          "evidence": "'Later mentions in the same unit are bare code spans' stated with no exception, not updated to reflect the new deep-link exemption"
        },
        {
          "surface": "src/Scans/sibling_link.jl:29-31 (later-mention check)",
          "swept": true,
          "evidence": "now scans and flags a repeated home-page link, the narrow case the fix covers"
        }
      ]
    },
    {
      "id": "2026-09-09-check-docs-02/operational-claims#9",
      "verdict": "HONORED",
      "question": "none",
      "evidence": "src/CLI/Rounds.jl:254 (unparsable branch) now uses `mv(p, replace(p, \".json\" => \".rejected.json\"); force = true)`, unifying it with the invalid (line 269) and lane-mismatch (line 276) branches, which already used that pattern — all three now rename identically. Docstring at src/CLI/Rounds.jl:254-257 reworded to '(absent, or — renamed to `<name>.rejected.json` beside itself — unparsable or invalid)', correctly excluding the absent case (src/CLI/Rounds.jl:262, `isfile(p) || return (:dead, nothing, nothing, \"absent\")`, no `mv` call) from the quarantine claim.",
      "class_surfaces": [
        {
          "surface": "src/CLI/Rounds.jl:254 (unparsable branch rename)",
          "swept": true,
          "evidence": "changed from `p * \".rejected.json\"` to `replace(p, \".json\" => \".rejected.json\")`"
        },
        {
          "surface": "src/CLI/Rounds.jl:269 (invalid branch rename)",
          "swept": true,
          "evidence": "already used the unified pattern, unchanged"
        },
        {
          "surface": "src/CLI/Rounds.jl:276 (lane-mismatch branch rename)",
          "swept": true,
          "evidence": "already used the unified pattern, unchanged"
        },
        {
          "surface": "src/CLI/Rounds.jl:262 (absent case)",
          "swept": true,
          "evidence": "docstring now correctly excludes it from 'quarantined' language; no mv occurs"
        }
      ]
    }
  ]
}
