{
  "schema_version": 1,
  "lane": "workflow-scripts",
  "graded_sha256": "b79ed176ea5e0b4df178c939ee36f2d56e1678b50d7eb0d5905cf586ccb76fbb",
  "pass_nonce": "9d99391b7f985c834c5e6cfc4e76855b",
  "verdicts": [
    {
      "id": "2026-09-09-check-docs-02/workflow-scripts#1",
      "verdict": "HONORED",
      "question": "none",
      "evidence": "instruments/audit-changes/workflow/audit.js:46 previously_worked added to SCHEMA.required; new schemaFor(lane) (lines 56-64) clones SCHEMA and strips previously_worked from `required` for every lane whose key !== 'behaviour-change'; the Audit dispatch (line 101) now calls `schema: schemaFor(lane)` instead of the bare SCHEMA, so the agent() structured-output constraint cannot omit the field on the behaviour-change lane. Matches catalog/lanes/audit-changes.toml:36 key = \"behaviour-change\" and PROTOCOL.md:70; Passes.jl:286's unsafe default is now unreachable for this lane.",
      "class_surfaces": [
        {
          "surface": "instruments/audit-changes/workflow/audit.js:50",
          "swept": true,
          "evidence": "required array now includes previously_worked, gated per-lane via schemaFor()"
        },
        {
          "surface": "src/CLI/Passes.jl:286",
          "swept": true,
          "evidence": "unsafe default now unreachable for the one lane that sets the field"
        },
        {
          "surface": "instruments/audit-changes/PROTOCOL.md:70",
          "swept": true,
          "evidence": "documentation already matched the design; now true in practice"
        }
      ]
    },
    {
      "id": "2026-09-09-check-docs-02/workflow-scripts#2",
      "verdict": "HONORED",
      "question": "none",
      "evidence": "instruments/check-consistency/workflow/panel.js:88 — the sole `needs.includes('git')` branch in the repo now reads \"...Read inside ${A.repo}; scope every search with `--glob '!.gbg/**'`. Never open anything under .gbg/...\", matching verify-act.js:59 and verify-state.js:51 (both unchanged in the diff).",
      "class_surfaces": [
        {
          "surface": "instruments/check-consistency/workflow/panel.js:88",
          "swept": true,
          "evidence": "grep over the repo returns only this one `needs.includes('git')` site, now scoped"
        }
      ]
    },
    {
      "id": "2026-09-09-check-docs-02/workflow-scripts#3",
      "verdict": "HONORED",
      "question": "none",
      "evidence": "instruments/bug-hunt/workflow/hunt.js:73 (end of FREE_PREAMBLE, dispatched as the head of the free lane's prompt at line 92) now reads \"Nothing under `.gbg/` or `~/.gbg/` is yours to open but the files this prompt names; scope every grep with `--glob '!.gbg/**'`.\" — the explicit boundary sentence plus glob scoping, landing in the actual dispatch text for both free lanes.",
      "class_surfaces": [
        {
          "surface": "instruments/bug-hunt/workflow/hunt.js:73 (FREE_PREAMBLE)",
          "swept": true,
          "evidence": "explicit boundary sentence plus --glob added, used by both free lanes via lane.kind === 'free' dispatch"
        }
      ]
    },
    {
      "id": "2026-09-09-check-docs-02/workflow-scripts#4",
      "verdict": "HONORED",
      "question": "none",
      "evidence": "instruments/bug-hunt/workflow/dismissals.js:7 — Args comment now reads \"... items: [{id, title}], items_sha, items_path, out, models: {economy} }\", matching the runtime required check at line 16 and the write at line 63.",
      "class_surfaces": [
        {
          "surface": "instruments/bug-hunt/workflow/dismissals.js:7",
          "swept": true,
          "evidence": "items_sha now listed in the header Args comment, aligned with the runtime-required list and schema"
        }
      ]
    },
    {
      "id": "2026-09-09-check-docs-02/workflow-scripts#5",
      "verdict": "HONORED",
      "question": "none",
      "evidence": "instruments/check-consistency/workflow/rubric-audit.js:74-75 computes `misassigned` (byHat keys absent from A.hats) and logs a `!!` line; lines 118-124 compute `orphaned`, increment tally.MISSED, add gaps entries with hat '(off-roster)', and the final Write payload now carries `misassigned`/`orphaned` alongside the rest.",
      "class_surfaces": [
        {
          "surface": "instruments/check-consistency/workflow/rubric-audit.js:65-68 (byHat construction)",
          "swept": true,
          "evidence": "the silent-drop path is now caught downstream by misassigned/orphaned before the artifact is written"
        }
      ]
    }
  ]
}
