{
  "schema_version": 1,
  "lane": "cold-reader",
  "graded_sha256": "9c0bccf80add89c6a05f0c08696278701eb8f5228eab2a7b944f8810562abcd6",
  "pass_nonce": "876502a63d9bafe897380fbd889ec85d",
  "verdicts": [
    {
      "id": "2026-09-10-check-docs-03/cold-reader#1",
      "verdict": "LINE-ONLY",
      "question": "strategy",
      "evidence": "src/CLI/Preflight.jl:260-262 still says anchor is \"whether the hat runs at full strength... unrelated to the file#heading anchors of Config.resolve_anchor\" — only 2 of the 3 senses. Config.jl, Doctor.jl and Seed.jl:47-51 all now state all three; this named site was left inconsistent, still omitting the seed-class regex sense.",
      "class_surfaces": [
        {
          "surface": "src/CLI/Config.jl:8-19",
          "swept": true,
          "evidence": "Module docstring already states all 3 senses (anchor/surface), pre-existing before this diff range."
        },
        {
          "surface": "src/CLI/Config.jl:112-125",
          "swept": true,
          "evidence": "resolve_anchor's docstring now names all 3 senses, this diff."
        },
        {
          "surface": "src/CLI/Init.jl:94",
          "swept": true,
          "evidence": "Mere reinforcement of the term after Config already disambiguates it; no separate gloss needed."
        },
        {
          "surface": "src/CLI/Seed.jl:47-51",
          "swept": true,
          "evidence": "Already states all 3 senses (\"a third sense of the word\"), unchanged and consistent."
        },
        {
          "surface": "src/CLI/Preflight.jl:260-262",
          "swept": false,
          "evidence": "Still names only 2 senses (hat flag, file#heading); the diff never touched Preflight.jl, so the seed-regex sense is absent here."
        },
        {
          "surface": "src/CLI/Doctor.jl:13-17,260-261",
          "swept": true,
          "evidence": "Module docstring and CFG.HATS comment rewritten this diff to name the same 3 senses as Config/Seed."
        }
      ]
    },
    {
      "id": "2026-09-10-check-docs-03/cold-reader#2",
      "verdict": "HONORED",
      "question": "none",
      "evidence": "src/DocLints.jl:17-18 and src/TestHarness.jl:591 now both write \"the quick doctor set — the `:QUICK` selection of [`GBGCodingTools.doctor`](@ref), the checks that hold on any machine with no build and no network\" — a real, working @ref (GBGCodingTools.doctor is a genuine top-level binding, CLI/Doctor.jl:800) plus an inline gloss, at both cited early-use sites.",
      "class_surfaces": [
        {
          "surface": "src/DocLints.jl:17",
          "swept": true,
          "evidence": "Gloss + @ref added this diff."
        },
        {
          "surface": "src/TestHarness.jl:591",
          "swept": true,
          "evidence": "Gloss + @ref added this diff."
        },
        {
          "surface": "src/CLI/Doctor.jl:5-9",
          "swept": true,
          "evidence": "Canonical QUICK definition, unchanged, still correct and is the @ref target's neighbourhood."
        }
      ]
    },
    {
      "id": "2026-09-10-check-docs-03/cold-reader#3",
      "verdict": "HONORED",
      "question": "none",
      "evidence": "Recall.jl:4-11 module docstring already glosses HAT/SUBSTRATE/ROSTER inline (pre-existing before this diff range, still present and consistent with Preflight); this pass adds the same gloss to suspect_hats' `roster` arg at Recall.jl:88 (\"the round's roster: the hats it resolved to run, each with its substrate\"), matching Preflight.resolve_hats/resolve_roster.",
      "class_surfaces": [
        {
          "surface": "src/CLI/Recall.jl:4-11",
          "swept": true,
          "evidence": "Module docstring defines HAT/SUBSTRATE/ROSTER at first use, pre-existing."
        },
        {
          "surface": "src/CLI/Recall.jl:88",
          "swept": true,
          "evidence": "roster arg gloss added this diff, consistent with module docstring and Preflight."
        },
        {
          "surface": "src/CLI/Preflight.jl:252-263,361-363",
          "swept": true,
          "evidence": "Canonical definitions, unchanged, consistent with Recall's glosses."
        }
      ]
    },
    {
      "id": "2026-09-10-check-docs-03/cold-reader#4",
      "verdict": "NEW-DEFECT",
      "question": "implementation",
      "evidence": "src/GBGCodingTools.jl:19 adds \"A surface is one named file set of `[surfaces]`: `source`, `docs`, `built_html` and the rest\" — but no surface key named `source` exists anywhere: schema/config.schema.json and Config.jl:149-155 (surface_files) name it `src`. The new definitional bullet fabricates a key name while fixing the missing-definition ask.",
      "class_surfaces": [
        {
          "surface": "src/GBGCodingTools.jl:19",
          "swept": false,
          "evidence": "New bullet names a nonexistent surface key `source` (should be `src`); schema/config.schema.json's surfaces object has no `source` property, only `src`."
        },
        {
          "surface": "src/CLI/Config.jl:8-19",
          "swept": true,
          "evidence": "Existing SURFACE gloss (pre-existing) correctly lists rationale/pages/src/ext/literate/data/docs/all — unaffected, still correct."
        },
        {
          "surface": "src/CLI/Config.jl:149-155",
          "swept": true,
          "evidence": "surface_files docstring correctly enumerates `src` (not `source`); unchanged, unaffected by the new defect."
        }
      ]
    }
  ]
}
