{
  "schema_version": 1,
  "lane": "templates",
  "graded_sha256": "b79ed176ea5e0b4df178c939ee36f2d56e1678b50d7eb0d5905cf586ccb76fbb",
  "pass_nonce": "6114c300132fdcbf435699389e69184a",
  "verdicts": [
    {
      "id": "2026-09-09-check-docs-02/templates#1",
      "verdict": "HONORED",
      "question": "none",
      "evidence": "templates/README.md: commit-message.tmpl row lost `{{package.name}}` (now `{{tool.version}}`, `{{files}}`); bump-message.tmpl row lost it too (now `{{from}}`, `{{to}}`, `{{files}}`, `{{abandoned}}`). Grep of both template files confirms no `{{package.name}}` present — rows now match template content exactly, per the hint's literal instruction.",
      "class_surfaces": [
        {
          "surface": "templates/README.md:22 (commit-message.tmpl row)",
          "swept": true,
          "evidence": "`{{package.name}}` dropped; remainder matches template"
        },
        {
          "surface": "templates/README.md:23 (bump-message.tmpl row)",
          "swept": true,
          "evidence": "`{{package.name}}` dropped; remainder matches template"
        }
      ]
    },
    {
      "id": "2026-09-09-check-docs-02/templates#2",
      "verdict": "HONORED",
      "question": "none",
      "evidence": "templates/regressions-README.md:1 changed to include `v{{tool.version}}`, matching SKILL.md.tmpl:6's form exactly. src/CLI/Sync.jl:221 renders this template with `s` (from `slots(cfg)`, which supplies `tool.version`), so the slot resolves at render time.",
      "class_surfaces": [
        {
          "surface": "templates/SKILL.md.tmpl:6",
          "swept": true,
          "evidence": "sibling cited by the finding; already correct, unchanged"
        },
        {
          "surface": "templates/claude-md.block:1",
          "swept": true,
          "evidence": "sibling cited by the finding; already correct, unchanged"
        },
        {
          "surface": "templates/gitignore.block:1",
          "swept": true,
          "evidence": "sibling cited by the finding; already correct, unchanged"
        },
        {
          "surface": "templates/regressions-README.md:1",
          "swept": true,
          "evidence": "flagged file; v{{tool.version}} added"
        }
      ]
    },
    {
      "id": "2026-09-09-check-docs-02/templates#3",
      "verdict": "HONORED",
      "question": "none",
      "evidence": "templates/README.md's Managed headers paragraph gained an explicit exception sentence naming queue-guard.sh.tmpl, matching the hint's first offered remedy verbatim in spirit ('qualify the paragraph with the exception'). This corrects the false blanket claim rather than dismissing it. src/CLI/Sync.jl:219 still calls template() raw with no header, consistent with the new text.",
      "class_surfaces": [
        {
          "surface": "templates/queue-guard.sh.tmpl:1",
          "swept": true,
          "evidence": "the only G-class, #-format template with no header; now explicitly carved out"
        },
        {
          "surface": "templates/settings.json.tmpl (JSON, no header)",
          "swept": true,
          "evidence": "already covered by pre-existing 'none for JSON' clause, not a #-format contradiction"
        }
      ]
    }
  ]
}
