{
  "schema_version": 1,
  "lane": "src",
  "graded_sha256": "b79ed176ea5e0b4df178c939ee36f2d56e1678b50d7eb0d5905cf586ccb76fbb",
  "pass_nonce": "a077d88211883f1c622e65e04d77c955",
  "verdicts": [
    {
      "id": "2026-09-09-check-docs-02/src#1",
      "verdict": "HONORED",
      "question": "none",
      "evidence": "All 12 named docstrings now carry 'The arguments are:' bulleted lists, e.g. TestHarness.jl:82-89 allocation_completeness, Gate.jl:8-19 gate, Seed.jl:38-52 select. Diff touches 34 of 36 src/ files with the same rewrite pattern; HtmlWalker.jl:47-53 and TreeHash.jl:34-40 (named in the finding's class description) are also converted.",
      "class_surfaces": [
        {
          "surface": "src/TestHarness.jl:83",
          "swept": true,
          "evidence": "allocation_completeness now bulleted: '- `pkg` — the package module.' etc."
        },
        {
          "surface": "src/Witnesses.jl:93",
          "swept": true,
          "evidence": "witness_project now bulleted: '- `root` — the consumer root.' etc."
        },
        {
          "surface": "src/Reflection.jl:311",
          "swept": true,
          "evidence": "signature_fidelity now bulleted: '- `cfg` — the validated config.' etc."
        },
        {
          "surface": "src/Scan.jl:268",
          "swept": true,
          "evidence": "regex_scan now bulleted: '- `cfg` —...' through '- `mask_code` —...'"
        },
        {
          "surface": "src/CLI/Config.jl:250",
          "swept": true,
          "evidence": "Config.parse now bulleted: '- `text` —...`root` —...`check` —...'"
        },
        {
          "surface": "src/CLI/Sync.jl:560",
          "swept": true,
          "evidence": "sync now bulleted: '- `cfg` —...`check` —...`io` —...`ledger` —...'"
        },
        {
          "surface": "src/CLI/Rounds.jl:223",
          "swept": true,
          "evidence": "classify_lane now bulleted: '- `dir` —...`inst` —...`lane` —...`first_sha` —...'"
        },
        {
          "surface": "src/CLI/Preflight.jl:185",
          "swept": true,
          "evidence": "resolve_hats now bulleted: '- `cfg` —...`profile` —...`explicit` —...'"
        },
        {
          "surface": "src/CLI/Bump.jl:12",
          "swept": true,
          "evidence": "bump now bulleted: '- `cfg` —...`ver` —...`abandon` —...`io` —...'"
        },
        {
          "surface": "src/CLI/Release.jl:7",
          "swept": true,
          "evidence": "release now bulleted: '- `ver` —...`io` —...`skip_tests` —...'"
        },
        {
          "surface": "src/CLI/Gate.jl:8",
          "swept": true,
          "evidence": "gate now bulleted: '- `cfg` —...`instruments...` —...`io` —...'"
        },
        {
          "surface": "src/CLI/Seed.jl:41",
          "swept": true,
          "evidence": "select now bulleted: '- `catalog` —...`full` —...`round` —...'"
        },
        {
          "surface": "src/HtmlWalker.jl:44-52 (attr, class-named file)",
          "swept": true,
          "evidence": "diff converts attr's one-line prose to a 3-bullet 'The arguments are:' list"
        },
        {
          "surface": "src/TreeHash.jl:32-42 (class-named file)",
          "swept": true,
          "evidence": "diff converts tree_hash's running prose to a 2-bullet 'The arguments are:' list"
        },
        {
          "surface": "spot-checked remaining src/CLI files via heuristic re-parse of every docstring+signature pair",
          "swept": true,
          "evidence": "candidates flagged by an independent paren-depth scan (TestHarness.jl:535,562,589, Witnesses.jl:160) were all already correctly bulleted on inspection — false positives of the checker, not survivors"
        }
      ]
    },
    {
      "id": "2026-09-09-check-docs-02/src#2",
      "verdict": "HONORED",
      "question": "none",
      "evidence": "args_form.jl:6 now `const ARGS_BULLET = r\"The\\s+arguments\\s+are:\"` (was a literal substring); confirmed `occursin(r\"The\\s+arguments\\s+are:\", \"...match across lines. The\\narguments are:\")` evaluates true in Julia. Scan.jl:233-234 and Preflight.jl:320-321 still wrap the phrase exactly as the finding quoted and both are now matched, not false-positived.",
      "class_surfaces": [
        {
          "surface": "src/Scans/args_form.jl:6 (ARGS_BULLET constant)",
          "swept": true,
          "evidence": "changed from `\"The arguments are:\"` to `r\"The\\s+arguments\\s+are:\"`, whitespace-tolerant across the newline"
        },
        {
          "surface": "src/Scans/args_form.jl:21 (bulleted = occursin(...))",
          "swept": true,
          "evidence": "occursin now called against the whitespace-tolerant regex, no code change needed at the call site itself"
        },
        {
          "surface": "src/Scan.jl:231-234 (prose_text docstring, line-wrapped marker)",
          "swept": true,
          "evidence": "text unchanged, now correctly detected as bulleted under the new regex"
        },
        {
          "surface": "src/CLI/Preflight.jl:320-321 (write_payloads docstring, line-wrapped marker)",
          "swept": true,
          "evidence": "text unchanged, now correctly detected as bulleted under the new regex"
        }
      ]
    },
    {
      "id": "2026-09-09-check-docs-02/src#3",
      "verdict": "HONORED",
      "question": "none",
      "evidence": "args_form.jl:29-46 replaced `c = findlast(')', sig)` with a depth-tracked scan from the first `(` to its matching `)`. Traced `argcov(cfg; exempt = (hit -> false)) -> (hits, population, skipped)`: depth returns to 0 at the paren closing `exempt`'s call, never reaching the return tuple — `inside` = `cfg; exempt = (hit -> false)`, exactly 1 pos + 1 kw, matching argcov's real signature.",
      "class_surfaces": [
        {
          "surface": "src/Scans/args_form.jl:16 (o/c computation)",
          "swept": true,
          "evidence": "replaced flat findfirst/findlast with a depth counter that stops at the FIRST balanced close, structurally excluding any `-> (...)` return tuple for every docstring parsed, not one instance"
        },
        {
          "surface": "src/Reflection.jl:154-166 argcov (the finding's own worked example)",
          "swept": true,
          "evidence": "src/Reflection.jl:173 confirms argcov's real signature is 1 pos + 1 kw (`exempt`); the fixed scan now derives the same count from the displayed signature"
        },
        {
          "surface": "src/CLI/Rounds.jl `load(cfg, round) -> (dir, record)`",
          "swept": true,
          "evidence": "generic depth-based fix applies uniformly; no per-function patch was needed or made"
        },
        {
          "surface": "src/CLI/Rounds.jl `classify_lane(...) -> (status, data, sha, note)`",
          "swept": true,
          "evidence": "same generic fix; confirmed function exists at Rounds.jl:260 with a 4-tuple return"
        },
        {
          "surface": "src/CLI/Demote.jl `demote(verdict) -> (verdict', demoted::Bool)`",
          "swept": true,
          "evidence": "same generic fix; confirmed function exists at Demote.jl:4 with a parenthesized tuple return"
        }
      ]
    },
    {
      "id": "2026-09-09-check-docs-02/src#4",
      "verdict": "HONORED",
      "question": "none",
      "evidence": "Preflight.jl:203-206 now reads: '`needs` holds the requirement tags (`html`, `git`, `rulebook`) `not_applicable` is computed from' — near-verbatim the hint's suggested clause. Verified against Preflight.jl:230-231: `na = (\"html\" in needs && isempty(...)) || (\"git\" in needs && !Git.is_repo(...)) || (\"rulebook\" in needs && isempty(...))` — matches the docstring's own parenthetical exactly.",
      "class_surfaces": [
        {
          "surface": "src/CLI/Preflight.jl:203-206 (resolve_hats docstring, needs field)",
          "swept": true,
          "evidence": "needs now explained with its content and purpose, same enumeration as the other fields the finding says were already explained"
        }
      ]
    },
    {
      "id": "2026-09-09-check-docs-02/src#5",
      "verdict": "HONORED",
      "question": "none",
      "evidence": "code_in_math.jl:2-3 comment changed from 'one-letter subscripts' to 'braced subscripts and superscripts of any length', matching the `[a-z]+` (one-or-more) quantifier in the unchanged regexes at line 178. Wording matches the hint's suggested phrasing.",
      "class_surfaces": [
        {
          "surface": "src/Scans/code_in_math.jl:2-3 (header comment)",
          "swept": true,
          "evidence": "comment now says 'braced subscripts and superscripts of any length', accurately describing the `_\\{[a-z]+\\}` / `^\\{[a-z]+\\}` regexes below it, unchanged at line 178"
        }
      ]
    }
  ]
}
